ID	PATH	INFO
38682	38682.jpg	AUTHOR: TORRITI, Jacopo, BORN-DIED: (active c. 1270-1300), TITLE: Deësis vault, DATE: 1290s, TECHNIQUE: Fresco, LOCATION: Upper Church, San Francesco, Assisi, FORM: painting, TYPE: religious, SCHOOL: Italian, TIMELINE: 1251-1300
39561	39561.jpg	AUTHOR: UNKNOWN MASTER, Dutch, BORN-DIED: (active around 1650), TITLE: Wall Tile Painter, DATE: c. 1650, TECHNIQUE: Black charcoal, LOCATION: Amsterdam Museum, Amsterdam, FORM: graphics, TYPE: study, SCHOOL: Dutch, TIMELINE: 1601-1650
40334	40334.jpg	AUTHOR: UNKNOWN MASTER, Italian, BORN-DIED: (active in 1500-1510 in Padua), TITLE: Toad, DATE: 1500-10, TECHNIQUE: Bronze, diameter cm, LOCATION: Kunsthistorisches Museum, Vienna, FORM: sculpture, TYPE: other, SCHOOL: Italian, TIMELINE: 1501-1550
40827	40827.jpg	AUTHOR: VASARI, Giorgio, BORN-DIED: (b. 1511, Arezzo, d. 1574, Firenze), TITLE: Allegory Related to Alchemy, DATE: c. 1570, TECHNIQUE: Oil on slate, LOCATION: Palazzo Vecchio, Florence, FORM: painting, TYPE: mythological, SCHOOL: Italian, TIMELINE: 1551-1600
40945	40945.jpg	AUTHOR: VELÁZQUEZ, Diego Rodriguez de Silva y, BORN-DIED: (b. 1599, Sevilla, d. 1660, Madrid), TITLE: Young Man, DATE: c. 1629, TECHNIQUE: Oil on canvas, 89 x 69 cm, LOCATION: Alte Pinakothek, Munich, FORM: painting, TYPE: portrait, SCHOOL: Spanish, TIMELINE: 1601-1650
41303	41303.jpg	AUTHOR: VERMEER, Johannes, BORN-DIED: (b. 1632, Delft, d. 1675, Delft), TITLE: View of Delft, DATE: 1659-60, TECHNIQUE: Oil on canvas, 97 x 116 cm, LOCATION: Mauritshuis, The Hague, FORM: painting, TYPE: landscape, SCHOOL: Dutch, TIMELINE: 1651-1700
41805	41805.jpg	AUTHOR: VERWILT, François, BORN-DIED: (b. ca. 1620, Rotterdam, d. 1691, Rotterdam), TITLE: Adoration of the Shepherds, DATE: c. 1660, TECHNIQUE: Oil on panel, 42 x 62 cm, LOCATION: Private collection, FORM: painting, TYPE: religious, SCHOOL: Dutch, TIMELINE: 1651-1700
42039	42039.jpg	AUTHOR: VITTORIA, Alessandro, BORN-DIED: (b. 1525, Trento, d. 1608, Venezia), TITLE: St Sebastian, DATE: 1566, TECHNIQUE: Bronze, height 54 cm, LOCATION: Metropolitan Museum of Art, New York, FORM: sculpture, TYPE: religious, SCHOOL: Italian, TIMELINE: 1551-1600
43111	43111.jpg	AUTHOR: WTEWAEL, Peter, BORN-DIED: (b. 1596, Utrecht, d. 1660, Utrecht), TITLE: Allegory of Love, DATE: -, TECHNIQUE: Oil on canvas, 68 x 106 cm, LOCATION: Private collection, FORM: painting, TYPE: mythological, SCHOOL: Dutch, TIMELINE: 1601-1650
43121	43121.jpg	AUTHOR: WYCK, Jan, BORN-DIED: (b. 1644, Haarlem, d. 1700, Mortlake), TITLE: A Boating Scene, DATE: -, TECHNIQUE: Oil on canvas, 60 x 92 cm, LOCATION: Private collection, FORM: painting, TYPE: landscape, SCHOOL: Dutch, TIMELINE: 1651-1700
